,location,text
41,"Portland, OR 97232 (Kerns area)","$59,072 - $101,026 a yearOne full-time position is available. This position will be filled at the assistant, associate or senior level depending on the successful candidate's qualifications. Appointments are typically made at or near the beginning of the salary range:
Assistant pay range: $59,072.00 - $79,164.80 annually
Associate pay range: $65,124.80 - $87,276.80 annually
Senior pay range: $75,400.00 - $101,025.60 annually
About you
Seeking an independent self-starter, critical thinker, data explorer and solutions-oriented travel demand modeler with a passion for service excellence and continual learning. Maybe you're a senior modeler who takes pride in your ability to look at a problem and reverse engineer a solution and you're looking to bring your experience to a large organization that offers something ""different"" or new. Or perhaps you're just starting out in your professional data science career and want the opportunity to apply an innovative, equity-focused approach to projects that impact our communities in a meaningful way while getting the chance to blaze your path in the career you've always desired. Wherever you may be in your career, prepare to learn and be challenged. If you think you're the one we've been looking for, we want to know more about you.

About us
The Modeling and Forecasting Services Division lives within the Research Center department at Metro. We are a nationally recognized group that is well known for our travel demand modeling expertise and innovative approaches to problem solving. We build and maintain custom modeling and forecasting tools that provide information to help our communities and residents make data-driven decisions. Here are some links to our department and samples of our work in our division:
The Research Center - https://www.oregonmetro.gov/tools-partners/data-resource-center
Modeling Services Division - https://www.oregonmetro.gov/modeling-services
About the work
How might people react to road tolling? How many residents might choose to take a new light rail line? Will introducing a new bike trail change the route a cyclist might take? How will cars and trucks contribute to our air quality in the future? What impacts might automated and connected vehicles have on the transportation system? What can be gleaned from ""big data"" to track new travel patterns and choices? These are the kinds of questions our forecasters help answer with travel demand models and innovative analytic techniques that delve into emerging data sources.

Travel demand models are a collection of mathematical and statistical computer programs that simulate a ""typical"" day of travel for large metropolitan areas, such as the greater Portland region. These models can be used to replicate present day conditions as well as make projections about the future. The team of modelers at Metro works collaboratively to collect data, conduct research and analyses and develop software that seeks to continually improve and evolve Metro's modeling toolkit.

In a typical week, you may be given tasks that can be as varied as collecting, analyzing and visualizing traffic data; assisting in the development of mapping applications; coding of multimodal transportation networks; applying travel demand models; evaluating the scope and extent of off-the-shelf modeling software products from vendors; or applying machine-learning techniques to extract meaning from emergent ""big data"" resources.

The more experienced modeler may be involved in household survey analysis and the design of new cutting-edge models. You will have the opportunity to work with and support both internal and external clients. The field is ever-changing and ""on-the-job"" development of relevant skills is highly encouraged at Metro. Software programming, database development and query methods, statistical analysis, data science, econometrics and GIS will be used extensively in this work.

Application requirements
1) Electronic application, 2) answer to supplemental questions and 3) resume.

At Metro, we hire a workforce representative of the communities we serve, understanding that a diverse workforce strengthens our organization. We value diversity and support a positive and welcoming environment where all of our employees can thrive.
 Essential Job Duties: An employee in this position must be able to perform all the essential job duties listed below with or without reasonable accommodation; however, this list is not intended to include all of the specific tasks which an employee in this position may be expected to perform.

Assistant Researcher and Modeler (click for link)- Performs duties primarily under the lead direction of senior staff:
Assists in the collection and organization of data for use in travel demand modeling and technical reports.
Assists in the application of travel demand models to produce estimates of multi-modal travel.
Assists with the analysis, interpretation, and summarization of the results obtained from the application of the travel demand model.
Develops and drafts technical reports.
Assists in the research and development of new statistical, software development, modeling techniques and methods, and new data management and analysis techniques.
Associate Researcher and Modeler (click for link) - Performs moderate to complex duties under general direction of senior and principal researcher and modelers.
Collects and organizes data for use in travel demand modeling and technical reports.
Applies the travel demand modeling software to produce estimates of multi-modal travel.
Analyzes, interprets, and summarizes the results obtained from the application of the travel demand model. Make recommendations based on numerical analysis.
Develops and drafts technical reports.
Assists in the research and development of new statistical, software development, modeling techniques and methods, and new data management and analysis techniques.
Acts as a liaison between technical staff and administrators, consultants and the public regarding modeling data and information.
Senior Researcher and Modeler (click for link) – Independently performs advanced and complex modeling duties and tasks. Supervision is received from the division manager and direction may be provided by other principal/senior modelers.
 Minimum Requirements: These positions are represented by AFSCME Local 3580 and are classified as either an Assistant, Associate or Senior Researcher and Modeler. Classification descriptions are typically written broadly and do not include the specific duties and responsibilities of the positions. More information about each position and a full list of the knowledge, skills and abilities can be found by selecting one or more of the links below:

Assistant Researcher and Modeler (click for link):
Demonstrated experience in quantitative planning or modeling with extensive computer programming/software development and/or statistics experience
Bachelor's degree in a quantitative science or related field
Or any combination of education and experience that provides the knowledge, skills and abilities required to perform the job.
Associate Researcher and Modeler (click for link):
Minimum requirements of the Assistant Researcher and Modeler and
One year of travel demand modeling, computer programming/software development, or data science experience
Or any combination of education and experience that provides the knowledge, skills and abilities required to perform the job.
Senior Researcher and Modeler (click for link):
Minimum requirements of the Associate Research and Modeler and
Three years of travel demand modeling, computer programming/software development, data science, or land use and real estate modeling experience
Or any combination of education and experience that provides the knowledge, skills and abilities required to perform the job.

Preferred experience – all positions:
Travel demand modeling, computer programming, software development, data science, machine learning, and/or statistics
Experience developing and evaluating data and informational tools with and equity perspective
Experience and/or ability with applying an innovative approach to problem solving within a data-driven environment.
 Additional Information: Online applications: Metro accepts job applications online. If you need assistance or accommodation with your application, or access to a computer, call 503-797-1570.

Accommodation: Reasonable accommodation is available to anyone whose specific disability prevents them from completing this application or participating in this process. To obtain confidential assistance please contact Human Resources at 503-797-1570.

Public Employees Retirement System (PERS): New employees will pay the employee portion of the PERS contribution.

Veterans' Preference: Under Oregon Law, qualified veterans may be eligible for veterans' preference when applying for Metro positions. If you are a veteran and would like to be considered for a veterans' preference for this job, please provide qualifying documents as instructed during the application process.

Criminal background check: In order to protect the wellbeing of its employees, the public and agency assets, Metro may conduct criminal background checks on candidates selected for Metro positions. Criminal convictions do not necessarily preclude employment and will be considered on a case by case basis. A background check will only be conducted if you are selected as a finalist for a position. If selected as a finalist, you will be contacted by Human Resources prior to the initiation of a background check.

Equal employment opportunity: All qualified persons will be considered for employment without regard to race, color, religion, sex, national origin, age, marital status, familial status, gender identity and expression, sexual orientation, disability for which a reasonable accommodation can be made or any other status protected by law. Assistance will be gladly provided upon request for any applicant with sensory or non-sensory disabilities.

An Equal Opportunity/Affirmative Action Employer"
42,"Houston, TX 77046 (Montrose area)","InternshipData science encompasses the computational and statistical skills required to use data in support of scientific enquiry and sound business decision-making. We are looking to hire candidates to work on challenging data science problems across our oil & gas businesses, including exploration, production, refining, chemicals, retail and corporate services.



Job Role Responsibilities

As an intern you will work side-by-side with our data scientists with responsibilities including:
Use data visualization, statistical analysis, pattern recognition, and machine learning – along with domain knowledge and subject-specific models – to solve science, engineering, and commercial problems
Data extraction/transformation/loading, data filtering and quality control, exploratory data analysis, feature engineering and visualization. Ability to work with both structured and unstructured data
Analyze results and develop technical reports and presentations


An intern typically has a summer long project tied closely to the data science domain culminating in a presentation to their peers and management sponsors.



Requirements

Currently pursuing a PhD or MS (exceptional BS candidates will be considered) in one of the following disciplines: Engineering/Sciences, Mathematics, Statistics or Computer Science with significant experience in data analytics.
Experience in Python, Scala, Java, C, C++ or R is required
The following experiences are all considered an advantage, but not required:
Using one or more of the following software packages: scikit-learn, numpy, pandas, jupyter, matplotlib, scipy, nltk, spacy, keras, tensorflow
Solving problems using techniques including Regression, Support Vector Machines, Decision trees, random forest, Boosting, PCA, KMeans
Using SQL/No SQL databases is an advantage
Working in Linux and in a High Performance Computing environment



Alternate Location: United States : Baytown, Texas || United States : Clinton, New Jersey || United States : Houston, Texas

ExxonMobil is an Equal Opportunity Employer. All qualified applicants will receive consideration for employment without regard to race, color, religion, sex, sexual orientation, gender identity, national origin, protected veteran status, or disability status.

Nearest Major Market: Houston

Job Segment: Database, Scientific, Engineer, Computer Science, SQL, Technology, Engineering"
43,"Anderson, SC 29621","Job Description


Clean and organize raw data from different sources.
Use descriptive statistics to summarize the overall picture.
Collect, organize, analyze, and present data for possible quality, test, manufacturing problems or trends to answer key questions.
Visualization of data analysis and derivation of recommended actions.
Creation/use of Machine learning models for predictions.
Testing and improving the performance of machine learning tools.
Systematic development and usage of statistical algorithms for the analysis of high-dimensional big data.
Evaluation of statistical models, determination of validity of the analysis.
Assist in the creation and maintenance of data collection and reporting procedures and systems to insure the validity of the data used for decisions.
Support problem-solving teams with data analysis for quality improvements, cost reductions, and cycle time reductions.
Co-development of data analysis on an existing analytics platform.
Process and implement changes in accordance with quality standards.
Support product teams, CIP activities and Policy Deployment objectives.
Translation of business needs into data-driven, technical solutions. Qualifications


4 yr. Degree (Computer Science or Computer Engineering) and 2 years’ experience as data scientist.
Knowledge in data analysis, statistics data mining, machine learning, visual analysis of big data.
Knowledge in machine learning models for predictions.
Knowledge in statistical algorithms.

Additional Information

By choice, we are committed to a diverse workforce - EOE/Protected Veteran/Disabled.
BOSCH is a proud supporter of STEM (Science, Technology, Engineering & Mathematics) Initiatives
FIRST Robotics (For Inspiration and Recognition of Science and Technology)
AWIM (A World In Motion)"
44,"Santa Clara Valley, CA","InternshipImagine what you could do here. At Apple, new ideas have a way of becoming extraordinary products, services, and customer experiences very quickly. Bring passion and dedication to your job, and there's no telling what we can accomplish together.
Do you love pursuing big challenges that require especially creative solutions? Can you intrinsically see the importance in every detail? Do you strive to craft elegant solutions to highly complex challenges?
Our Platform Architecture group is responsible for connecting our hardware and software into one unified system, and we design technologies to work seamlessly in unison. Join this team, and you’ll develop forward-looking prototype systems in collaboration with engineers across Apple. We take daring, revolutionary ideas and turn them into reality. You and your team will apply engineering fundamentals and start from scratch if need be. Together, our work will lead to the intuitive technology experiences that Apple is known for worldwide.
Apple’s Platform Architecture group is looking for a motivated engineer with a strong background in data science and numerical processing. Join a team of expert hardware and software engineers to architect and implement tools to improve the collection and analysis of large amounts of data. The candidate must be self-driven with initiative. The candidate must have multi-disciplinary skills with a focus in tools development, a knack for automation and experience with processing large datasets.

Key Qualifications
Strong background in:
Data science
Numerical processing
Data visualization
Proficient at:
Python3
Matplotlib / Bokeh (or similar)
Pandas
Numpy
Description
The candidate will build tools to aid in the processing, storage, and visualization of large datasets. This work will include but is not limited to: application development, lab automation, data analysis and data visualization tools.

Education
Pursuing a BS, MS or Ph.D in CS or CE. Must be graduating December 2019 or later."
45,"Salt Lake City, UT 84180 (Downtown area)","We're hiring a Data Scientist in Salt Lake City who is passionate about using technology to make the world a better place. What's it like to work at Radiant? You will be our point person for user retention, think A/B tests, data analysis, ML, NLP. You'll be part of our engineering team, but collaborate deeply with Design, Product, and Marketing to reliably retain users on our Radiant platform products.
Our teams are collaborative ' we sit together, brainstorm together, and build together because we believe that's the only way to make superior products. We're committed to innovation ' so much so, in fact, that we hold quarterly hack-a-thons to let individuals and teams build projects and hit for the fences with radical new ideas. We believe in spreading goodness so much that we match your charitable contributions to non-profit organizations. If you are a tenacious data scientist who enjoys a rapidly growing environment, has a passion for finding insights in data, and thrives even in uncertain conditions, consider applying.
What We Do:
We're building innovative mobile and web applications.
Our team has a strong preference for simple, elegant solutions to customer needs.
We build applications that people love, and make a difference in their everyday lives!
What We Need You To Do:
Work with Product, Marketing, and Design to define and implement A/B and multivariate tests.
Design and implement growth and retention experiments, from generating ideas to analysis of experiment results.
Utilize statistical analysis to drive user retention.
Ensure tests get up and running and be willing and able to help product and marketing teams interpret results and present them to management without bias.
What we look for:
Innate interest in learning about customer behavior, using both quantitative and qualitative methods.
Great with data and analysis tools.
Create and implement algorithms in relevant statistical inference, graph, and network analysis, natural language processing with open source tools and libraries.
Design and support efficient storage and retrieval of Big Data.
Develop highly accurate machine learning models to help improve in-product experiences and drive business growth.
Excellent Python, R, or Scala skills.
Able to think strategically and tackle open-ended problems.
Willing to learn what you don't already know.
Bonus points for:
Experience in product management, user acquisition marketing or similar fields.
Deep understanding of SEO/SEM, social and viral mechanics.
Aid in productionizing projects including, but not limited to, developing API endpoints, creating datasets and associated visualizations, deploying AWS Lambdas, and creating scheduled Airflow jobs.
Experience with data pipelines, warehousing and reporting systems.
Bachelor's Degree. (Preferred Master's Degree or above in Data Science, Statistics, Computer Science, Math, or similar quantitative field) or equivalent work experience.
About Radiant
Radiant is an experience company focused on developing innovative products and supporting content that make a better world for individuals, families and communities. We're constantly prototyping, launching and tuning to truly solve customer problems. We are dedicated to the fight against iffy, shoddy software. We make better, more usable tools for making the world a better place. A better-connected world and more effective ways for everyone, everywhere to communicate, make discoveries, share knowledge, be inspired, and do big things. We accomplish all this by giving smart, creative, passionate people opportunities to create awesome.
Benefits
Medical, Dental, AD&D, Life, and Vision Insurance.
Charitable donation matching.
Paid time off and 11 paid holidays.
Flexible schedule.
Fully stocked kitchen and catering.
401K (with a company match).
Tuition Reimbursement.
Lift desks, comfy chairs, and a casual dress code"
46,"Dallas, TX","$15 an hourTemporary, InternshipOverview
Data Scientist Intern – Corporate Strategy

As a member of the Data Science Team the Intern will serve as an internal consultant, responsible for collecting, organizing, analyzing, summarizing, and interpreting data to help drive actionable decisions and generate competitive advantage.
Responsibilities
The Data Science Intern will assist this department with a variety of responsibilities including but not limited to:

Assist with data science projects, working with business Customers to understand contextual problems quickly and define, analyze, and deliver solutions based on business objectives
Applies math, statistics, and/or advanced modeling methods in order to create solutions which can be utilized in descriptive, diagnostic, predictive, and prescriptive analytics
Interacts with functional leaders across multiple and concurrent projects
Formulates and communicates solutions and options for moderately complex problems
Creates and communicates results from moderately complex data analysis and models
Supports the ongoing effectiveness of models in use by business Customers
Supports the ongoing development of the Southwest Airlines data science center and community
Qualifications
BASIC QUALIFICATIONS:
High School Diploma, GED or equivalent education required.
Must be at least 18 years of age
Must have authorization to work in the United States as defined by the Immigration Reform Act of 1986.

EDUCATION:
Candidates must be currently enrolled in a fulltime Bachelor’s Degree program with a Major/Minor in Applied Mathematics, Business, Computer Science, Economics, Engineering, Information Systems, Math, Science, Statistics or related degree program.
Minimum of Junior level by hours (60+) at the start of the internship preferred
Maintained 3.0 or above cumulative GPA

SKILLS/ABILITIES/KNOWLEDGE/WORK STYLE:
Strong communication and influencing skills are required, including the ability to interact directly with the Senior Leadership team.
Must have strong problem solving skills, including the ability to gather facts, conduct analysis, and translate data into meaningful insights.
Experience working with predictive and prescriptive statistical methods preferred.
Alteryx experience preferred.
Experience with a data science project preferred.
Experience in stat programming language preferred (R, python) required.
Experience in developing and delivering presentations is preferred.
Experience with relational database and noSQL database preferred.
Experience working and problem solving with cross-functional teams is preferred.
Previous experience with an internship in a related position within the last 12 months is preferred.

Location and Pay:
Pay of $15.00 per hour + flight privileges
This position is located in Dallas, Texas at the Southwest Airlines Headquarters.

Southwest Airlines is an Equal Opportunity Employer.
All Students must apply online at careers.southwestair.com"
