,location,text
61,"Santa Clara Valley, CA","Imagine what you could do here. At Apple, new ideas have a way of becoming outstanding products, services, and customer experiences very quickly. Bring passion and dedication to your job and there’s no telling what you could accomplish. Are you in love with data? Do you love deciphering obscure statistics? If so, we would love to have you in AppleCare.
We are creating a new, hybrid role that mixes the best of data science with survey research.
We are looking for someone with a Data Science background that will help us discover the information hidden in vast amounts of data, and help us make smarter decisions to deliver even better customer experiences. Your primary focus will encompass three areas.
1. Advanced statistical analysis
2. Applying data science techniques
3. Leading survey programs
1. ADVANCED STATISTICAL ANALYSIS
Our team is responsible for analyzing the survey data we collect. You’ll be responsible for supporting the team when advanced statistical techniques are required.
2. APPLYING DATA SCIENCE TECHNIQUES
In this role we are looking for someone to lead data science projects such as:
- Automate scoring using machine learning techniques
- Build recommendation systems
- Build system for automated fraud detection
3. LEADING SURVEY PROGRAMS
Finally, you’ll be asked to lead ongoing customer satisfaction tracker programs. Specific activities include:
- Leading data sampling processes, including database queries
- Organizing large raw data sets
- Merging customer and transactional data for analysis
- Creating and delivering data-based, actionable, and compelling presentations for internal business leaders
- Working with the business to ensure optimized research utilization
- Crafting survey questions

Key Qualifications
5+ years of experience in analyzing data and reporting
Strong data mining and statistical modeling background
Mathematical knowledge understanding of machine learning techniques such as regression, time series analysis, clustering, decision tree techniques
Recent experience with building models such as Forecasting growth, predicting churn, Customer clustering and detecting anomaly
Experience in data engineering in Big Data systems
Expertise in crafting Data Models for high performance and scalability
Experience with Spark, Hadoop or other distributed frameworks
Experience in high-level programming language for analysis (e.g. Python, R, Scala)
Description
Proven project management skills and attention to detail
Advanced SQL
Good communication skills
Able to flexibly, and independently problem-solve in a dynamic environment
Survey Questionnaire design
Teradata
Education
BA/BS/BE in a quantitative field (Statistics, Computer Science, Ops Research etc.)
Masters or PhD in Statistics/Mathematics is a plus
Apple is an equal opportunity employer that is committed to inclusion and diversity. We also take affirmative action to offer employment and advancement opportunities to all applicants, including minorities, women, protected veterans, and individuals with disabilities. Apple will not discriminate or retaliate against applicants who inquire about, disclose, or discuss their compensation or that of other applicants."
62,United States,"At Toptal, we measure everything and always rely on data to guide all of our initiatives, including both our long-term strategy and our day-to-day operations. As a Data Scientist on our Analytics Team, you will be working with our cross-functional team to model complex problems, discover actionable business insights, and identify high-impact opportunities. You will be part of a high-energy, fast-paced team responsible for supporting initiatives and operations across the company.
We have freedom to choose the best tool for the job. That’s why:
Our infrastructure is in Google Cloud Platform,
For research we leverage both Python and R,
Our ETL pipelines and production models are in Python and Scala.
The ultimate goal is solving real business problems. We work on problems that deeply affect the operation of our business. This ranges from predictive models, controlling and optimizing the client flow, and other very open-ended questions. For example, our stakeholders may ask if it is feasible to pursue a certain business direction and, if so, what are the implications on business processes and the costs of moving to that solution.
This is a remote position that can be done from anywhere. However, we do things like rent out hotels in Africa or mansions in Thailand, and you will certainly be invited to come work with us.
Responsibilities:
Use statistical, algorithmic, data mining, and visualization techniques to model complex problems, identify opportunities, discover solutions, and deliver actionable business insights.
Own your projects and use this autonomy to find creative and innovative ways of solving problems and delivering solutions.
Handle both parts of the Research & Development process, including clean, rigorous implementations of devised models inside our Analytics system.
Be persistent, focused, and disciplined when it comes to finishing your work. At Toptal we always drive research from start to finish - we don’t get distracted; we don’t leave anything unfinished.
Communicate data-driven insights and recommendations to key stakeholders.
Be in constant communication with team members and other relevant parties and convey results efficiently and clearly via Slack.
Requirements:
A strong background in advanced mathematics, in particular in probability theory and statistics, data mining, and machine learning.
You must be able to think critically, to look at the big picture and spot what is missing, taking advantage of it to propose improvements and deliver business insights.
4+ years of professional experience in data science, doing exploratory data analysis, testing hypothesis, and building predictive models.
Ability to quickly and accurately understand complex new concepts.
Proficiency in a programming language of your own choice (R, Python, Matlab, etc.), and previous experience efficiently conducting research and creating ad hoc reports.
An excellent ability to learn new programming languages quickly and effectively.
Big pluses include: strong experience managing or shipping out a product, managing a team, and working on open source projects.
Working experience with Airflow and Dimensional Modeling is a plus.
Be excited about collaborating daily with your team and other groups while working via a distributed model.
Be eager to help your teammates, share your knowledge with them, and learn from them.
Be open to receiving constructive feedback.
You must be a world-class individual contributor to thrive at Toptal. You will not be here just to tell other people what to do."
63,"Merrifield, VA 22119","Employee Perks
Why You Will Love Being Part of the Navy Federal Team:Competitive compensation with opportunities for annual raises, promotions, and bonus potentialBest-in-Class Benefits! (7% 401k match / Pension plan / Tuition reimbursement / Great insurance options)On-site amenities include fitness center, wellness center, cafeteria, etc. at Pensacola, FL; Vienna, VA and Winchester, VA campusesConsistently Awarded Top WorkplaceNationally recognized training department by TRAINING Magazine IND123An employee-focused, diverse, and service-oriented workplace environment
Basic Purpose
To lead the development and marketing execution of large scope data science, quantitative research analytics, and advanced statistical marketing analytics insights & algorithms for assigned internal business units to enable better understanding of customer needs, behaviors, and engagement. Serve as lead Predictive Modeler working either independently or leading projects. Mentor junior predictive modelers with advanced analytics and thought guidance in the development of models and collaborative insights with stakeholders. Formulate strategies around customer targeting, product & service acquisition, and retention for more effective marketing. Provide input & insight to mid and executive-level management across the company with answers to business questions and information to assist with data-driven & customer-centric decision making.

Responsibilities

Collaborate with internal business partners across divisions to integrate analytical tools and solutions into direct marketing, lead generation campaigns/initiatives, and agent/customer systems
Develop and refine customer behavioral algorithms to help focus corporate and divisional activities supporting corporate growth, retention, customer experience and long term profitability
Develop and test multiple hypotheses using results from analyses to generate and answer new questions leading to more in-depth understanding of customer behavior being studied
Evaluate/develop/implement analytical techniques and best practices to gain a competitive advantage
Forecast initiatives to project strategic plan goals and assess current performance
Identify potential issues that arise during the course of research projects and escalate and communicate these to management and internal clients for awareness/action/resolution
Recommend & collaborate with cross functional marketing team to develop customer-centric integrated marketing campaigns based on data insights
Identify, recommend and manage external suppliers/vendors assisting on analytical research projects, ensure projects meet departmental quality standards, research objectives, and delivered on time
Lead ad hoc analysis of corporate-wide business problems of various scope and complexity
Lead development of machine learning projects using varied advanced analytical techniques for estimating current and future customer engagement, prospecting new customers, cross-selling to existing customers (response models), and identifying customers likely to leave
Make presentations of status and results of analysis to non-technical audience of various levels
Manage multiple research projects under tight deadlines; ensure research projects are completed on time and meet internal client expectations
Monitor performance of algorithms; recommend/implement changes to improve performance
Perform full cycle model design, development, documentation and deployment which includes but is not limited to identifying objectives, sampling, testing/validation, calibration, and monitoring performance
Pro-actively work with internal clients and other business areas to create project plans with clear objectives, detailed tasks, accountabilities, time lines, and estimated budgets/corporate impact
Produce actionable insights from research projects that are effectively communicated
Perform other duties as assigned

Qualifications

Master's Degree in Statistics, Mathematics, Decision Science, Economics, Engineering or relevant quantitative field
3-5 years of relevant data science experience or the equivalent combination of training, education, and experience
Experience in an informal mentoring, and/or leadership role
Experience working in a consultative capacity to champion and develop advanced analytics for marketing & advertising optimization (DSPs targeting, Response Modeling, Media Mix, Attribution, Key Driver Analysis etc.)
Experience with leveraging marketing & advertising technologies for personalization
Experience with building algorithms on a distributed system (i.e. Hadoop) using near-real time and streaming data
Experience in advanced quantitative modeling for market research
Significant experience in managing multiple fast-moving priorities independently and/or in a cross-functional team environment to achieve goals
Significant experience in statistical software and/or analytic programming languages to manage large data sets
Significant work experience in using a majority of the following statistical methods to solve business problems: linear and logistic regression, neural networks, decision trees, experimental design, time-series and forecasting, clustering, association rules, RFM, and/or survival analysis
Proven track record of algorithm implementation for Marketing personalization and optimization
Advanced skill building effective relationships through rapport, trust, diplomacy and tact
Advanced skill interpreting, extrapolating and interpolating data for statistical research and modeling
Advanced skill to influence, negotiate and persuade to reach agreeable exchange and positive outcomes
Advanced skill using innovative thinking to solve problems and facilitate the decision-making process
Desired - Advanced knowledge of Navy Federal products, services, programs, policies and procedures
Desired - Advanced knowledge of data analytics for financial service regulatory compliance

Hours:
Monday-Friday, 8:00AM-4:30PM
Equal Employment Opportunity

Navy Federal values, celebrates, and enacts diversity in the workplace. Navy Federal takes affirmative action to employ and advance in employment qualified individuals with disabilities, disabled veterans, Armed Forces service medal veterans, recently separated veterans, and other protected veterans. EOE/AA/M/F/Veteran/Disability"
64,"Benicia, CA","Job Description:
This is a key position within a rapidly growing enterprise. High performers in this role have an opportunity to quickly assume additional responsibilities, develop their knowledge and understanding of our business model, and have preferred access to promotional opportunities! The position is based at our corporate headquarters in Benicia, CA, less than one hour from 3 major airports and the Napa/Sonoma region of Northern California.

Responsibilities:
Work with stakeholders throughout the organization (Operations/Supply Chain, Sales/Marketing, Finance, etc.) to identify opportunities for leveraging company data to drive business solutions
Develop scalable statistical, machine learning or mathematical solutions for complex business problems such as Pricing, Inventory Reordering, and Demand Forecasting
Perform analytical studies and generate actionable recommendations. Use statistical techniques and hypothesis testing to validate your findings
Qualifications
Ideal Candidate:
2-5 years of experience in leveraging data for business impact
A deep understanding of statistical analysis (e.g. hypothesis testing, experimentation, regressions) and machine learning algorithms (supervised and unsupervised models)
Demonstrated programming experience with at least one analytic tool (R, Python, Scala, etc.).
Ability to write and optimize complex SQL queries.
Experience in building and deploying cloud-based data pipelines and applications (GCP, AWS) is a plus
Ability to communicate clearly and effectively to cross-functional partners of varying technical levels
Ability to work independently and proactively as well as collaborating in a team
A good sense of humor is always a big plus!
IND1"
65,"Oklahoma City, OK","$62,000 - $72,000 a yearDo you own a t-shirt that reads “I love Linear Algebra”? Are deep neural nets not quite deep enough for you? Did you almost lose a Turing test to a machine? If so, we want to get to know you.Human Mode LLC is a new Oklahoma City based research company working on software projects in the realms of AI, Virtual Reality and Augmented Reality. We are looking for a talented software engineer who is passionate about artificial intelligence and machine learning concepts and can apply their engineering skills and fascination to help make our environments and games even more compelling. Come and invent with us.ResponsibilitiesQuickly build proof of concepts utilizing AI techniques in games and other productsImplement game AI techniques such as path following and complex spawning techniquesWork on enhanced AI projects including deep neural networks, NLP, pattern recognition and reinforcement learningDevelop and implement artificial intelligence libraries or APIs for general use by otherCollect and optimize training dataBuild data warehouses to assist in business intelligence projects.Stay current with relevant tools and best practices in the fields of AI and machine learningDocument and implement best practicesCollaborate with management and the development team to help projects meet their deadlines.Assist company in securing and maintaining intellectual propertyQualificationsMasters or bachelor’s degree in computer scienceBackground in algorithms including, probability theory, computer vision, search, machine learning, neural nets, deep learning.Enthusiastic about games and AIAbility to read recent AI related research papers and apply those concepts in code.Experience with version controlExperience in AI or machine learning related frameworks (TensorFlow, sci-kit learn, Caffe)Strong Experience in Python, C#, or bothPreferred QualificationsAn interest in building cool stuffAbility and willingness to quickly learn new platforms.Worked on or delivered projects in Deep Learning, Machine Learning, Computer Vision, NLPGood multi-tasking and adaptabilityExperience with Relational databases a plus.Experience with Unity3D or Unreal Engine a plus.Experience with common off-the-shelf BI tools a plusBenefits and PerksFull-Time PositionRetirement PlanMedical BenefitsPaid VacationsGym Membership ReimbursementHuman Mode LLC is an equal opportunity employer providing opportunity to all individuals regardless of race, religion, creed color, gender, disability, age, sexual orientation, veteran status, national origin or any other characteristic protected by federal, state or local law.Job Type: Full-timeSalary: $62,000.00 to $72,000.00 /yearExperience:Machine Learning: 1 year (Preferred)Python: 2 years (Preferred)Software Development: 2 years (Preferred)SQL: 1 year (Preferred)Natural Language Processing: 1 year (Preferred)Computer Vision: 1 year (Preferred)C#: 2 years (Preferred)Neural Network: 2 years (Preferred)Education:Bachelor's (Required)Location:Oklahoma City, OK (Preferred)Work authorization:United States (Required)"
66,"Santa Clara Valley, CA","The Retail Analytics team is looking for an exceptional individual to play an integral role in helping Apple Retail make decisions using data. You will partner with key stakeholders across Apple as you design, refine, and create innovative analyses and data products. This will include leveraging large and complex data sources, deriving actionable insights, delivering dynamic and intuitive decision tools, and presenting your findings to key executives.
The ideal candidate is a self-motived team player, skilled in a broad set of analytical tools, with a strong passion for data and effective visualization techniques. Ability to adapt quickly and communicate effectively with business leaders is a must.
Key Qualifications
2+ years of related work experience in consulting or other related business facing role
Fluency in SQL for data access, manipulation, and validation
Proficiency in either R, Python or SAS for data analysis
Passion for data visualization and information design (proficiency in Tableau preferred)
Capable of clearly communicating complex analyses to a non-technical audience, including extensive experience presenting to leadership groups
Ability to initiate, refine, and complete projects with minimal guidance
Description
Partner with cross-functional teams to identify, frame, prioritize, and answer business questions where analytics can be most impactful
Design and implement analytics and reporting tools to support key decisions on a wide variety of topics including product launches, customer experience, and operational performance
Quickly outline and build customized analyses for Retail leadership
Perform all aspects of analysis including data acquisition and manipulation, programming, data visualization, documentation, and presentation of results
Contribute to the development of tools to improve team efficiency and productivity
Education
Minimum of bachelor’s degree, preferably in related quantitative field
Additional Requirements
Apple is an Equal Opportunity Employer that is committed to inclusion and diversity. We also take affirmative action to offer employment and advancement opportunities to all applicants, including minorities, women, protected veterans, and individuals with disabilities. Apple will not discriminate or retaliate against applicants who inquire about, disclose, or discuss their compensation or that of other applicants."
67,Remote,"About The Opportunity
Got a taste for something new?

We’re Grubhub, the nation’s leading online and mobile food ordering company. Since 2004 we’ve been connecting hungry diners to the local restaurants they love. We’re moving eating forward with no signs of slowing down.

With more than 85,000 restaurants and over 15.6 million diners across 1,600 U.S. cities and London, we’re delivering like never before. Incredible tech is our bread and butter, but amazing people are our secret ingredient. Rigorously analytical and customer-obsessed, our employees develop the fresh ideas and brilliant programs that keep our brands going and growing.

Long story short, keeping our people happy, challenged and well-fed is priority one. Interested? Let’s talk. We’re eager to show you what we bring to the table.

Grubhub is looking for an innately curious, business-minded, results-oriented Data Scientist with a focus on predictive modelling. In this highly visible role, you will build and deploy models predicting various aspect of the business’ logistics. You will also perform analysis to inform on the business.
Specific responsibilities include, but are not limited to, data analysis, problem solving, development of predictive models, deployment and maintenance of those models.
Some Challenges You’ll Tackle
Understand the business! Work directly with stakeholders to address their needs.
Build models, from selecting features to optimizing.
Be a stakeholder for our models! Help guide and prioritize development of predictive models to enhance our capabilities.
Question our assumptions! Find new and better ways to do what we’re doing.
Produce novel analysis giving insights into the business
Relentlessly analyze and improve the performance of our business.
You Should Have
2-5 years of experience applying descriptive statistics, machine learning, building predictive models and visualization to solve real-world problems
MSc or PhD in in statistics, mathematics, computer science or another quantitative field
Comfort communicating analytical findings to people of diverse backgrounds using statistical libraries and visualization tools in Python
Excellent programming skills in Python
Data querying capabilities using SQL
Ability to explain technical concepts in simple terms to business stakeholders

Got These? Even Better
Experience deploying regression, GLM, tree-based and Bayesian models with Python in a production environment
Experience with distributed data and computing tools like Spark, Hive and Presto
Experience using cloud infrastructure like AWS
A knack for analyzing and improving processes using data
And Of Course, Perks!
Unlimited paid vacation days. Choose how your time is spent.
Never go hungry! We provide weekly GrubHub/Seamless credit.
Regular in-office social events, including happy hours, wine tastings, karaoke, bingo with prizes and more.
Company-Wide Initiatives encouraging innovation, continuous learning and cross-department connections.

We deliver favorites every day. Join us as we move eating forward.
Grubhub is an equal opportunity employer. We evaluate qualified applicants without regard to race, color, religion, sex, sexual orientation, gender identity, national origin, disability, veteran status, and other legally protected characteristics. The EEO is the Law poster is available here: DOL Poster. Grubhub is committed to working with and providing reasonable accommodations to individuals with disabilities. If you need a reasonable accommodation because of a disability for any part of the employment process, please send an e-mail to TalentAcquisition@grubhub.com and let us know the nature of your request and your contact information."
